SuppMat/SuppMatPlots/diffusion_decay_comparison/run_error_metrics.csv

metric,tool,run_id,dx_um,dt_min,resolution_label,point_count,duration_min,first_time_min,last_time_min,relative_point_count,mean_absolute_error_uM,time_weighted_mean_absolute_error_uM,l2_error_uM,max_absolute_error_uM,mean_relative_error_percent,time_weighted_mean_relative_error_percent,l2_relative_error_percent,max_relative_error_percent
average,BioDynaMo,BioDynaMo_N_48,5.0,,"N=48 voxels/dim, dx=5 um",10000.0,9.999,0.0,9.999,10000.0,0.25695587067128584,0.25696799110420093,0.2602337465162244,0.2715312463918851,3.7131812931627186,3.7133546659330077,3.772462582493359,3.959307612810841
average,BioDynaMo,BioDynaMo_N_24,10.0,,"N=24 voxels/dim, dx=10 um",10000.0,9.999,0.0,9.999,10000.0,0.5165117506712859,0.5165361629213826,0.5228091411584226,0.544832993618023,7.462603955667025,7.46295303317101,7.577639287701126,7.944433642857961
average,BioDynaMo,BioDynaMo_N_12,20.0,,"N=12 voxels/dim, dx=20 um",1000.0,9.99,0.0,9.99,1000.0,1.0268328892002827,1.0273192648031708,1.0393339814838567,1.0818873238309124,14.83348542304648,14.840438134500666,15.061901967392886,15.775453360626448
average,BioDynaMo,BioDynaMo_N_6,40.0,,"N=6 voxels/dim, dx=40 um",1000.0,9.99,0.0,9.99,1000.0,1.9272761692002827,1.9281927532916592,1.9490786747509283,2.0232235289405383,27.83294950656958,27.84604486074958,28.23639422740184,29.501455516208853
average,Chaste,Chaste_N_48,5.0,,"N=48 voxels/dim, dx=5 um",1001.0,10.0,0.0,10.0,1001.0,0.18679060986433293,0.18687959676223995,0.18872863803010023,0.1956074239146508,2.6966806618554684,2.697951225524813,2.7331981820889286,2.85223398502247
average,Chaste,Chaste_N_24,10.0,,"N=24 voxels/dim, dx=10 um",1001.0,10.0,0.0,10.0,1001.0,0.36951725411008757,0.3696933677672404,0.37341084790840784,0.38680719391465157,5.3349937398243314,5.337508634505402,5.408013113041606,5.640198117510777
average,Chaste,Chaste_N_12,20.0,,"N=12 voxels/dim, dx=20 um",1001.0,10.0,0.0,10.0,1001.0,0.7206558529512461,0.72099922298724,0.728315094865456,0.7545716339146509,10.4049937624187,10.409897393259113,10.548392326109617,11.002725844006694
average,Chaste,Chaste_N_6,40.0,,"N=6 voxels/dim, dx=40 um",1001.0,10.0,0.0,10.0,1001.0,1.3432143474667313,1.3438539361522408,1.3576566308463738,1.407251323914652,19.394529769327427,19.403664437862425,19.664388936493534,20.519722468655264
average,CompuTiX,CompuTiX_N_63_dt_0.0001min,3.80952,0.0001,"N=63 voxels/dim, dx=3.81 um, dt=1.0e-04 min",100.0,9.9001,0.0,9.9001,100.0,0.196891611085518,0.19782136899076622,0.20056418405763987,0.2097147643101973,2.84596892410777,2.859273940152156,2.9079324286666943,3.0579390386908996
average,CompuTiX,CompuTiX_N_31_dt_0.0001min,7.7419400000000005,0.0001,"N=31 voxels/dim, dx=7.74 um, dt=1.0e-04 min",100.0,9.9001,0.0,9.9001,100.0,0.3872134895324376,0.3890389964908225,0.39462110270758416,0.4130241907138448,5.597772934281579,5.623903528351249,5.7222409413391455,6.022479150234489
average,CompuTiX,CompuTiX_N_15_dt_0.0001min,16.0,0.0001,"N=15 voxels/dim, dx=16.00 um, dt=1.0e-04 min",100.0,9.9001,0.0,9.9001,100.0,0.7731087778999146,0.7767401004194862,0.7887452546486876,0.8273159135187003,11.180004225663927,11.23201541541459,11.440404402611264,12.063440713658059
average,CompuTiX,CompuTiX_N_7_dt_0.0001min,34.285700000000006,0.0001,"N=7 voxels/dim, dx=34.29 um, dt=1.0e-04 min",100.0,9.9001,0.0,9.9001,100.0,1.528026811248791,1.5351418386148803,1.562796462102074,1.6475001799645241,22.111705403139737,22.21374628441533,22.680720761130864,24.022890712939937
average,PhysiCell,PhysiCell_dx_5um,5.0,,voxel size=5 um,1001.0,10.0,0.0,10.0,1001.0,0.06787389139528148,0.06790458098826711,0.06974562097324177,0.07436859681926755,0.9840491665884203,0.9844910158859512,1.0137272408727955,1.0843997381147534
average,PhysiCell,PhysiCell_dx_10um,10.0,,voxel size=10 um,1001.0,10.0,0.0,10.0,1001.0,0.3721341725272263,0.37231081771591695,0.3762879471971562,0.390977967672975,5.37403443537847,5.37655796285334,5.451477235141353,5.7010139210179105
average,PhysiCell,PhysiCell_dx_20um,20.0,,voxel size=20 um,1001.0,10.0,0.0,10.0,1001.0,0.9747061399830987,0.9751683818757197,0.9859740476699438,1.0249284947240822,14.077762628472827,14.084367934723199,14.285886445445433,14.944912756202378
average,PhysiCell,PhysiCell_dx_40um,40.0,,voxel size=40 um,1001.0,10.0,0.0,10.0,1001.0,1.9146545508920108,1.9155647436165402,1.9360305726629903,2.008923652724766,27.649613952203662,27.66261708648515,28.046133976613884,29.292959341447016
average,TiSim,TiSim_N_40,6.0,,"N=40 bins, dx=6 um",201.0,9.984,0.0,9.984,201.0,0.3054048068225539,0.30650976246131245,0.3116785525387607,0.32616532377984697,4.41843259907918,4.434290034324271,4.522545294635512,4.7559535450370625
average,TiSim,TiSim_N_20,12.0,,"N=20 bins, dx=12 um",201.0,9.984,0.0,9.984,201.0,0.6169774386633502,0.6190935292882357,0.627350476908985,0.6538173237798475,8.91716298192697,8.947818393986248,9.09548691856448,9.53358494030548
average,TiSim,TiSim_N_10,24.0,,"N=10 bins, dx=24 um",201.0,9.984,0.0,9.984,201.0,1.2198528167728027,1.22384128890362,1.2381268980862523,1.2879753237798468,17.620837547335846,17.67901680297315,17.941706723604913,18.780509025495324
center,BioDynaMo,BioDynaMo_N_48,5.0,,"N=48 voxels/dim, dx=5 um",10000.0,9.999,0.0,9.999,10000.0,0.116081622634939,0.11608654058866236,0.1220327521383235,0.1338208573887818,4.111128503621531,4.111298081087524,4.358750250015773,4.831288677188503
center,BioDynaMo,BioDynaMo_N_24,10.0,,"N=24 voxels/dim, dx=10 um",10000.0,9.999,0.0,9.999,10000.0,0.25559565849949895,0.2556065919583593,0.26786591623932676,0.2925440067102665,9.037578727251976,9.037954441281235,9.557752032335241,10.561628297403201
center,BioDynaMo,BioDynaMo_N_12,20.0,,"N=12 voxels/dim, dx=20 um",1000.0,9.99,0.0,9.99,1000.0,0.608232468917397,0.6084951720862743,0.636002202585677,0.6915840064178731,21.47391099789367,21.48290988307636,22.668525453407298,24.968049400777897
center,BioDynaMo,BioDynaMo_N_6,40.0,,"N=6 voxels/dim, dx=40 um",1000.0,9.99,0.0,9.99,1000.0,1.6667234696596138,1.6674647373937985,1.7258207217587118,1.8523940064178732,58.47221686016619,58.497275924222635,61.2553666745919,66.87642373557217
center,Chaste,Chaste_N_48,5.0,,"N=48 voxels/dim, dx=5 um",1001.0,10.0,0.0,10.0,1001.0,0.0018653128963644961,0.0018666648108896476,0.0028462990922513377,0.010910142328601324,0.05080057217127696,0.05083283767644657,0.06077975658056493,0.16909953545757178
center,Chaste,Chaste_N_24,10.0,,"N=24 voxels/dim, dx=10 um",1001.0,10.0,0.0,10.0,1001.0,0.006169571034000195,0.006173613288405408,0.006872619542377527,0.015098581123817567,0.19371469326317145,0.1938316060839333,0.2029970804070669,0.3416602111367954
center,Chaste,Chaste_N_12,20.0,,"N=12 voxels/dim, dx=20 um",1001.0,10.0,0.0,10.0,1001.0,0.024933661193840245,0.0249479104984053,0.02631886163069001,0.05037063896803318,0.82391270384097,0.8243508824305475,0.8513706216967463,1.3055837684693377
center,Chaste,Chaste_N_6,40.0,,"N=6 voxels/dim, dx=40 um",1001.0,10.0,0.0,10.0,1001.0,0.10974409368568404,0.10980499223774094,0.11571920873266518,0.21979469908085747,3.6477119079711375,3.6495961639789996,3.7628448160890984,5.559235948628881
center,CompuTiX,CompuTiX_N_63_dt_0.0001min,3.80952,0.0001,"N=63 voxels/dim, dx=3.81 um, dt=1.0e-04 min",100.0,9.9001,0.0,9.9001,100.0,0.07900317203194734,0.07933562442751657,0.08365708215706096,0.09221292998465502,2.801123489770187,2.8126102170550347,2.9902664307403644,3.329127342763395
center,CompuTiX,CompuTiX_N_31_dt_0.0001min,7.7419400000000005,0.0001,"N=31 voxels/dim, dx=7.74 um, dt=1.0e-04 min",100.0,9.9001,0.0,9.9001,100.0,0.14944757203194733,0.15007301702961146,0.15851586490042685,0.17510765852331378,5.302980790853422,5.324627811484435,5.668677377294398,6.321855334818931
center,CompuTiX,CompuTiX_N_15_dt_0.0001min,16.0,0.0001,"N=15 voxels/dim, dx=16.00 um, dt=1.0e-04 min",100.0,9.9001,0.0,9.9001,100.0,0.2769509633462672,0.2780967787232507,0.29476888538753016,0.3271261248690247,9.842297460784042,9.88208642494325,10.550791998727533,11.81013554837197
center,CompuTiX,CompuTiX_N_7_dt_0.0001min,34.285700000000006,0.0001,"N=7 voxels/dim, dx=34.29 um, dt=1.0e-04 min",100.0,9.9001,0.0,9.9001,100.0,0.47458570792737886,0.4765014938585642,0.5085916224263386,0.5700261986289017,16.90979765289604,16.976701966254044,18.234154951364808,20.57948289931032
center,PhysiCell,PhysiCell_dx_5um,5.0,,voxel size=5 um,1001.0,10.0,0.0,10.0,1001.0,0.03513153060700263,0.03514557322153004,0.03744134237815254,0.04217783215919724,1.2472231904422724,1.247709046837561,1.3433932685584804,1.5227335903075239
center,PhysiCell,PhysiCell_dx_10um,10.0,,voxel size=10 um,1001.0,10.0,0.0,10.0,1001.0,0.17935369763743134,0.1794316910452544,0.1868770106056652,0.2027205796287097,6.318979773269276,6.3216393729814495,6.654209922771828,7.318760122192175
center,PhysiCell,PhysiCell_dx_20um,20.0,,voxel size=20 um,1001.0,10.0,0.0,10.0,1001.0,0.5721485101363075,0.5723979432780244,0.5959231096028974,0.6454307368388146,20.153280518494853,20.161782903117466,21.212326835453844,23.30179179175966
center,PhysiCell,PhysiCell_dx_40um,40.0,,voxel size=40 um,1001.0,10.0,0.0,10.0,1001.0,1.6431992034513259,1.643931265084148,1.6995690458019495,1.8222751412584617,57.60445181460383,57.62916174071232,60.29947372955051,65.78905141220184
center,TiSim,TiSim_N_40,6.0,,"N=40 bins, dx=6 um",201.0,9.984,0.0,9.984,201.0,0.14205695016445724,0.14236930719021468,0.14936878495185027,0.1635247959214019,5.028934803032402,5.036417016259871,5.332430279112987,5.903686081010201
center,TiSim,TiSim_N_20,12.0,,"N=20 bins, dx=12 um",201.0,9.984,0.0,9.984,201.0,0.3214466995312681,0.3222743539456888,0.33509585529837604,0.36337696457519275,11.320534578847838,11.341269149524507,11.928521324878137,13.118889074018172
center,TiSim,TiSim_N_10,24.0,,"N=10 bins, dx=24 um",201.0,9.984,0.0,9.984,201.0,0.7850487661859467,0.7868256460274776,0.816789947057585,0.8839670062199567,27.61324211066008,27.658492914934733,29.065194751564537,31.91359498421476

meta_test/baseline_6aa51a3/table1_summary.md

## Reaction-diffusion, decay

- BioDynaMo: dx = 40 um: +29.50 % (centre +66.88 %); dx = 20 um: +15.78 % (centre +24.97 %); dx = 10 um: +7.94 % (centre +10.56 %); dx = 5 um: +3.96 % (centre +4.83 %)
- Chaste: dx = 40 um: +20.52 % (centre -3.53 %); dx = 20 um: +11.00 % (centre -0.77 %); dx = 10 um: +5.64 % (centre -0.15 %); dx = 5 um: +2.85 % (centre +0.04 %)
- CompuTiX: dx = 34.29 um: -24.02 % (centre -20.58 %); dx = 16 um: -12.06 % (centre -11.81 %); dx = 7.74 um: -6.02 % (centre -6.32 %); dx = 3.81 um: -3.06 % (centre -3.33 %)
- PhysiCell: dx = 40 um: +29.29 % (centre +65.79 %); dx = 20 um: +14.94 % (centre +23.30 %); dx = 10 um: +5.70 % (centre +7.32 %); dx = 5 um: -1.08 % (centre -1.52 %)
- TiSim: dx = 24 um: +18.78 % (centre +31.91 %); dx = 12 um: +9.53 % (centre +13.12 %); dx = 6 um: +4.76 % (centre +5.90 %)